{
  "version": "1.0.0",
  "repositoryHash": "a0ca2ee5e21122937003887086f376e49e598dc9575c5c04623a569e0b1962f4",
  "nodeCount": 7,
  "edgeCount": 26,
  "nodes": [
    {
      "id": "RC-001",
      "nodeType": "cultivar",
      "label": "Bloodgood",
      "scientificName": "Acer palmatum 'Bloodgood'",
      "slug": "bloodgood",
      "taxonId": "TAX-APAL",
      "status": "frozen-reference-standard",
      "summary": "Acer palmatum 'Bloodgood' is a frozen Atlas reference cultivar. Habit: Upright-growing, broadening small tree or large shrub. Leaf form: Non-dissected; normally five to seven lobes. Spring foliage: Reddish purple. Summer foliage: Dark red-purple to wine-red. Autumn foliage: Bright red to crimson. Moderate at best.",
      "traits": {
        "habit": "Upright-growing, broadening small tree or large shrub",
        "leafForm": "Non-dissected; normally five to seven lobes",
        "springColor": "Reddish purple",
        "summerColor": "Dark red-purple to wine-red",
        "autumnColor": "Bright red to crimson",
        "bark": "Gray-brown mature bark; bark is not the principal governed ornamental character.",
        "light": "Sun to partial shade, with climatic qualification",
        "sizeClass": "Large shrub / small tree"
      }
    },
    {
      "id": "RC-002",
      "nodeType": "cultivar",
      "label": "Seiryu",
      "scientificName": "Acer palmatum 'Seiryu'",
      "slug": "seiryu",
      "taxonId": "TAX-APAL",
      "status": "frozen-reference-standard",
      "summary": "Acer palmatum 'Seiryu' is a frozen Atlas reference cultivar. Habit: Upright; erect, vase-shaped to broadly columnar. Leaf form: Deeply dissected; horticulturally associated with the dissectum or laceleaf group. Spring foliage: Light green, commonly with reddish tips or margins. Summer foliage: Green to medium green. Autumn foliage: Variable gold, yellow, orange, red and crimson. Strongly characteristic; not independently authenticating.",
      "traits": {
        "habit": "Upright; erect, vase-shaped to broadly columnar",
        "leafForm": "Deeply dissected; horticulturally associated with the dissectum or laceleaf group",
        "springColor": "Light green, commonly with reddish tips or margins",
        "summerColor": "Green to medium green",
        "autumnColor": "Variable gold, yellow, orange, red and crimson",
        "bark": "Bark is not the principal governed ornamental character.",
        "light": "Full sun to partial shade, with regional qualifications",
        "sizeClass": "Small tree"
      }
    },
    {
      "id": "RC-003",
      "nodeType": "cultivar",
      "label": "Sango-kaku",
      "scientificName": "Acer palmatum 'Sango-kaku'",
      "slug": "sango-kaku",
      "taxonId": "TAX-APAL",
      "status": "frozen-reference-standard",
      "summary": "Acer palmatum 'Sango-kaku' is a frozen Atlas reference cultivar. Habit: Upright, vase-shaped small tree or large shrub. Leaf form: Palmate, usually five- to seven-lobed; not a dissected laceleaf cultivar. Spring foliage: Pinkish yellow, yellow-green or light green, sometimes with reddish margins. Summer foliage: Green. Autumn foliage: Predominantly yellow to golden yellow, sometimes with orange or reddish tones. Coral-pink to coral-red young bark, strongest in winter.",
      "traits": {
        "habit": "Upright, vase-shaped small tree or large shrub",
        "leafForm": "Palmate, usually five- to seven-lobed; not a dissected laceleaf cultivar",
        "springColor": "Pinkish yellow, yellow-green or light green, sometimes with reddish margins",
        "summerColor": "Green",
        "autumnColor": "Predominantly yellow to golden yellow, sometimes with orange or reddish tones",
        "bark": "Coral-pink to coral-red young bark, strongest in winter",
        "light": "Full sun to partial shade, subject to regional heat and moisture conditions",
        "sizeClass": "Large shrub / small tree"
      }
    },
    {
      "id": "RC-004",
      "nodeType": "cultivar",
      "label": "Crimson Queen",
      "scientificName": "Acer palmatum 'Crimson Queen'",
      "slug": "crimson-queen",
      "taxonId": "TAX-APAL",
      "status": "frozen-reference-standard",
      "summary": "Acer palmatum 'Crimson Queen' is a frozen Atlas reference cultivar. Habit: Arching, pendulous, cascading and broadly mounding. Leaf form: Deeply dissected, narrow-lobed and lace-like. Spring foliage: Deep red to reddish purple. Summer foliage: Reddish purple, with comparatively strong color retention. Autumn foliage: Scarlet, crimson, red, orange, purple or bronze. Leaf scorch under drought, hot sun or drying winds.",
      "traits": {
        "habit": "Arching, pendulous, cascading and broadly mounding",
        "leafForm": "Deeply dissected, narrow-lobed and lace-like",
        "springColor": "Deep red to reddish purple",
        "summerColor": "Reddish purple, with comparatively strong color retention",
        "autumnColor": "Scarlet, crimson, red, orange, purple or bronze",
        "bark": "Bark is not the principal governed ornamental character.",
        "light": "Full sun to partial shade, with regional heat qualifications",
        "sizeClass": "Small tree"
      }
    },
    {
      "id": "RC-005",
      "nodeType": "cultivar",
      "label": "Aureum",
      "scientificName": "Acer shirasawanum 'Aureum'",
      "slug": "aureum",
      "taxonId": "TAX-ASHI",
      "status": "frozen-reference-standard",
      "summary": "Acer shirasawanum 'Aureum' is a frozen Atlas reference cultivar. Habit: Bushy, upright-rounded to broadly rounded; often multistemmed. Leaf form: Rounded, orbicular to suborbicular and fan-like. Spring foliage: Bright yellow to golden yellow, sometimes edged or tinged red. Summer foliage: Bright yellow, yellow-green or greenish yellow depending on exposure and climate. Autumn foliage: Yellow-gold, orange, orange-red or red-purple; may be weak or curtailed by scorch or early browning. Rounded, shallowly lobed yellow to yellow-green foliage.",
      "traits": {
        "habit": "Bushy, upright-rounded to broadly rounded; often multistemmed",
        "leafForm": "Rounded, orbicular to suborbicular and fan-like",
        "springColor": "Bright yellow to golden yellow, sometimes edged or tinged red",
        "summerColor": "Bright yellow, yellow-green or greenish yellow depending on exposure and climate",
        "autumnColor": "Yellow-gold, orange, orange-red or red-purple; may be weak or curtailed by scorch or early browning",
        "bark": "Bark is not the principal governed ornamental character.",
        "light": "Partial shade generally preferred; full sun only where heat and moisture conditions permit",
        "sizeClass": "Small tree"
      }
    },
    {
      "id": "TAX-APAL",
      "nodeType": "taxon",
      "label": "Acer palmatum",
      "scientificName": "Acer palmatum",
      "commonName": "Japanese maple",
      "rank": "species",
      "status": "accepted"
    },
    {
      "id": "TAX-ASHI",
      "nodeType": "taxon",
      "label": "Acer shirasawanum",
      "scientificName": "Acer shirasawanum",
      "commonName": "Shirasawa maple",
      "rank": "species",
      "status": "accepted"
    }
  ],
  "edges": [
    {
      "id": "REL-000001",
      "fromId": "RC-001",
      "toId": "TAX-APAL",
      "fromType": "cultivar",
      "toType": "taxon",
      "typeId": "RLT-BELONGS-TO-TAXON",
      "type": "belongs-to-taxon",
      "category": "taxonomy",
      "directionality": "directed",
      "label": "Bloodgood belongs to Acer palmatum",
      "inverseLabel": "Acer palmatum includes Bloodgood",
      "strength": 5,
      "confidence": "high",
      "status": "approved",
      "rationale": "The frozen Reference Standard governs Bloodgood under the accepted species Acer palmatum.",
      "evidenceAssertionIds": [
        "AST-000002"
      ],
      "sourceIds": [
        "SRC-000001"
      ],
      "properties": {
        "scope": "accepted taxonomy",
        "inheritance": "qualified"
      }
    },
    {
      "id": "REL-000002",
      "fromId": "RC-002",
      "toId": "TAX-APAL",
      "fromType": "cultivar",
      "toType": "taxon",
      "typeId": "RLT-BELONGS-TO-TAXON",
      "type": "belongs-to-taxon",
      "category": "taxonomy",
      "directionality": "directed",
      "label": "Seiryu belongs to Acer palmatum",
      "inverseLabel": "Acer palmatum includes Seiryu",
      "strength": 5,
      "confidence": "high",
      "status": "approved",
      "rationale": "The frozen Reference Standard governs Seiryu under the accepted species Acer palmatum.",
      "evidenceAssertionIds": [
        "AST-000024"
      ],
      "sourceIds": [
        "SRC-000002"
      ],
      "properties": {
        "scope": "accepted taxonomy",
        "inheritance": "qualified"
      }
    },
    {
      "id": "REL-000003",
      "fromId": "RC-003",
      "toId": "TAX-APAL",
      "fromType": "cultivar",
      "toType": "taxon",
      "typeId": "RLT-BELONGS-TO-TAXON",
      "type": "belongs-to-taxon",
      "category": "taxonomy",
      "directionality": "directed",
      "label": "Sango-kaku belongs to Acer palmatum",
      "inverseLabel": "Acer palmatum includes Sango-kaku",
      "strength": 5,
      "confidence": "high",
      "status": "approved",
      "rationale": "The frozen Reference Standard governs Sango-kaku under the accepted species Acer palmatum.",
      "evidenceAssertionIds": [
        "AST-000046"
      ],
      "sourceIds": [
        "SRC-000003"
      ],
      "properties": {
        "scope": "accepted taxonomy",
        "inheritance": "qualified"
      }
    },
    {
      "id": "REL-000004",
      "fromId": "RC-004",
      "toId": "TAX-APAL",
      "fromType": "cultivar",
      "toType": "taxon",
      "typeId": "RLT-BELONGS-TO-TAXON",
      "type": "belongs-to-taxon",
      "category": "taxonomy",
      "directionality": "directed",
      "label": "Crimson Queen belongs to Acer palmatum",